"id","naslov","labela","podtip","napomena"
"sportklub_ed56704563","Anketa DPA: Nemcima nije do fudbala sa SP posle ponoći","1","",""
"sportklub_6d1735a637","(VIDEO) Drama u penal seriji: CSKA osvojio Kup Bugarske","0","",""
"sportklub_1261577f0f","Janakopulosu gori, a Željku?","1","",""
"sportklub_ae773cb591","Dalićev konačni spisak za nastup Hrvatske na Mundijalu","0","",""
"sportklub_70902521f7","Ovako će Zvezda isplaćivati Ibona: Objavljeni detalji dogovora","0","",""
"sportklub_fcb0984d58","Albanija ima novog selektora","0","",""
"sportklub_a316dab5fc","Nikitović: Incident? To je deo sporta i igre…","1","",""
"sportklub_b2b14f8db1","Radonjić propustio meč loptu, odluka u Kazanju","0","",""
"sportklub_66c6d63564","Đoković se zadržao na četvrtom mestu ATP liste","0","",""
"sportklub_86b9b05cb4","Bošković menja Jovančevića u štafeti 4 x 100 metara","0","",""
"sportklub_2efc4bb2c5","Predizborno obećanje: Jirgen Klop na klupi Reala!","0","",""
"sportklub_8726124eca","Slovenac MVP finalnog turnira Lige šampiona","0","",""
"sportklub_b7b47a10aa","Nema straha od Dubaija: Jako i hrabro do brejka u Zenici","1","",""
"sportklub_bf5d359e14","Alkaras: Ne želim da se pretvorim u roba tenisu","1","",""
"sportklub_6ff093b875","NCAA spušta rampu za igrače iz Evrolige?","0","",""
"sportklub_1f1343f287","Florentinu Perezu stigao odgovor od Barselone","1","",""
"sportklub_ad14d06504","Gudurićeva dirljiva poruka Veselom: Brate moj…","1","",""
"sportklub_317e5508fa","Preminuo mladi fudbaler Sloge Milan Radulović","0","",""
"sportklub_759dc0d7f4","Bakić osvojio srebro u Laškom, Tajland je sve bliži…","1","",""
"sportklub_9c17d0c68b","Njujork na pola puta do finala, Klivlend pao i drugi put","0","",""
"sportklub_763feadbec","(VIDEO) Vezenkov pogodio sa pola terena, Milutinov van tima","0","",""
"sportklub_0ece59a738","Akosta za SK: Mnogo još posla imamo","0","",""
"sportklub_1ff0a88fc9","Bode je zaboravljen: Kristijan Kivu dobija novi ugovor","0","",""
"sportklub_a0e9b8dce8","Crvena zvezda ima novog trenera!","1","",""
"sportklub_f4a2d89dde","Mesi u trci sa vremenom: Neće biti potpuno spreman","0","",""
"sportklub_822afe7b40","Muratoglu: Potvrđena ahilova peta Janika Sinera","1","",""
"sportklub_e1ea963e79","(VIDEO) Šejev povratak u velikom stilu, OKC izjednačio","0","",""
"sportklub_b1c4679534","Pogledajte kako su igrači Arsenala dočekali trenutak krunisanja","0","",""
"sportklub_d95b8563d2","(VIDEO) Vembanjama uništio Minesotu","0","",""
"sportklub_d4397c3440","Tinejdžer upucan tokom „slavlja“ navijača Njujork Niksa","0","",""
"sportklub_8e8f1e260a","Vratio se: Dominacija Markesa u Balatonu","0","",""
"sportklub_92fad67965","Krunić na ceremoniji: Planirate li da završite karijeru?","1","",""
"sportklub_4b820ac845","Došao je kraj: Real se zahvalio iskusnom defanzivcu","1","",""
"sportklub_67a464974c","Džered Batler: Velikim delom krivica je moja","0","",""
"sportklub_9f3919aea1","Iranci stigli u Meksiko, imali specijalnu poruku upućenu domaćinu","1","",""
"sportklub_d4623f17db","Andrejeva: Ne slušam šta Ukrajinke pričaju o nama","0","",""
"sportklub_cebbccdfc4","Dimitrijević – opet ništa od dolaska u Partizan","0","",""
"sportklub_3979817d84","Holand čestitao Arsenalu na tituli","0","",""
"sportklub_fb418b7a77","Srcolomac Maeda: Seltik u finišu preoteo titulu i završio bajku!","0","",""
"sportklub_d0e120449f","Beker i Kurijer veruju da Đoković može da osvoji Vimbldon","0","",""
"sportklub_e1dfd73bc6","Niksi deluju nezaustavljivo – Još pobeda do finala!","0","",""
"sportklub_ace0b5d291","Kuman saopštio spisak Holanđana, bez dve velike zvezde","1","",""
"sportklub_33a386f1b3","Spremao Novaka u Melburnu, osvojio titulu na Rolan Garosu","1","",""
"sportklub_23cd33ae7d","Epski preokret Niksa, Od -20 u Q4 do pobede – Anunobi heroj","0","",""
"sportklub_5cc0d6788e","Janik Siner šokantno ispao sa Rolan Garosa! Pozlilo mu je…","0","",""
"sportklub_34d70f7e18","Zlata vredan brejk Cibone u Zadru, uz velike planove…","0","",""
"sportklub_a7f927ce5d","Večeras na Mundijalu: Nemci i Kurasao pa Holanđani i Japan","0","",""
"sportklub_7e71114f92","Armani najavio pohod za titulu – stotkom!","0","",""
"sportklub_58572d00e1","Vembanjama predvodi najbolju defanzivnu petorku","0","",""
"sportklub_76a6e2fe8f","Problem pred Hrvatska – Engleska? Ozbiljan fijasko u najavi…","1","",""
"sportklub_546b28151e","Novi ambiciozni projekat se seli u Rim, GM – Zoran Savić!","0","",""
"sportklub_b83fd9620a","Šou je počeo! Dva gola i tri direktna crvena na startu Mundijala","0","",""
"sportklub_6919829f92","Srušen jak transfer, Avdić mora na dugu pauzu","1","",""
"sportklub_53752b90d1","Tadić: Piksi je hteo da okrene svlačionicu protiv mene","0","",""
"sportklub_24b8bdfa28","Napeto u Meksiku: Vojska na ulici uoči otvaranja Mundijala","0","",""
"sportklub_92e1fea3cb","Sjajan start Srbije u Ligi nacija, za tri boda protiv Argentine","0","",""
"sportklub_629ad7683a","(VIDEO) Nije samo majstor za asistencije: Kakva golčina Bruna!","0","",""
"sportklub_96a17d3c4d","„Ode Božo, legenda Borca i Čačka, ostaju priče za sva vremena“","0","",""
"sportklub_d3b7b0fd6b","„Endi je odmah znao da će Novak dominirati a ne Rafa i Rodžer“","0","",""
"sportklub_9ea12cc645","Đokoviću preti veliki pad na svetskoj listi posle Rolan Garosa","0","",""
"sportklub_6781fa367e","Prvorazredna senzacija: Budvani nokautirali Kotorane!","0","",""
"sportklub_6a6df27426","Teodosić sportski direktor Crvene zvezde, kraj puta za Dozeta!","0","",""
"sportklub_ef0520b36c","(VIDEO) Prekid i drama u Mostaru, Zrinjski osvojio Kup BIH!","0","",""
"sportklub_160e7fe370","Četvorica u 61 hiljaditinki – Gevara tik ispred Salača do pola","0","",""
"sportklub_9dcb40c67f","Šćepanović za SK: Za ovakve utakmice se živi!","0","",""
"sportklub_9719f4cbc7","Milojević pred novim angažmanom","0","",""
"sportklub_f4c958e05d","Legendarni Kanađanin igra na Svetskom prvenstvu","1","",""
"sportklub_4323e1836e","Jovanin Finiks konačno dobio","1","",""
"sportklub_02dfef183a","Koboli protiv Ože-Alijasima za istorijski plasman u Top 10","0","",""
"sportklub_fd2b129e01","Njujork ponovo živi za košarku","0","",""
"sportklub_c8aa52dc09","Nole, Hamad i pogled 1.453 kilometra od stadiona Filip Šatrije","1","",""
"sportklub_c1e8772612","SK: Partizan poslao ponudu za Seka, očekuje se brz odgovor Torina","0","",""
"sportklub_9b0647a814","„Dva najbolja tima su u finalu, domaći parket je prednost“","1","",""
"sportklub_d3e53972b3","Profesoru Nediću ukinuta suspenzija","0","",""
"sportklub_565ca7d01f","Tanasković odgovorio Terziću: Takve reči ne donose dobro sportu","0","",""
"sportklub_d11da25016","Gojko: Ako postoji neopravdani bojkot, zahvalio bih se igračima","0","",""
"sportklub_4e721acc6b","Lesor: Imamo petoricu na terenu, a oni nekada i osmoricu…","1","",""
"sportklub_340b9312e3","Nije „mitsko biće“: Mesina stiže na finale u Loznicu","0","",""
"sportklub_c75ed6c1a8","Rasim pred Skupštinu: Muka mi je od izgovora, neću da tražim pare","0","",""
"sportklub_a9f1a639b1","Prvi gol na Mundijalima, i to protiv Nemaca: Kurasao čini čuda!","0","",""
"sportklub_c783dd1ffd","(VIDEO) Reč junaka: Mi smo jedna otporna grupa","1","",""
"sportklub_3ade088d5a","Bivša šampionka nije iskoristila meč lopte","1","",""
"sportklub_fdebb02e57","Euro NIL: Kako Srbija može da iskoristi benefite NCAA košarke?","0","",""
"sportklub_a6423b5c54","Gudurić odličan, prednost za Armani u borbi za finale","0","",""
"sportklub_25b967ff8b","Liverpul podiže spomenik Diogu Žoti","0","",""
"sportklub_1957fdcb03","Zvezda dogovorila još jednog ofanzivca, plaća 3.000.000 €","1","",""
"sportklub_3dce2956d1","Liga nacija: Ukrajina za istoriju, Holandija pregazila Tursku","0","",""
"sportklub_9b0158caa6","Čuveni Španac dobio otkaz u Panatinaikosu","1","",""
"sportklub_92e57b66bd","Povici iz Fenera: Najsramniji F4 u poslednjih nekoliko godina","1","",""
"sportklub_19e8bac927","Hapoel se zahvalio Amerikancu na saradnji posle 13 utakmica","1","",""
"sportklub_f31c76cae9","Montero MVP, Valensija „počistila“ Huventud za novo finale","0","",""
"sportklub_1628b85452","SK u Atini: Vodimo vas u zemlju čuda sa Alisom","1","",""
"sportklub_f09123c8f1","Hal razmatra svoje opcije za direktan plasman u Premijer ligu","1","",""
"sportklub_a4c9203b84","Dogovoreno: Partizan konačno vraća svoje dete!","1","",""
"sportklub_3804f282b9","Očaj Čime Monekea: Nismo povezani sa Sašom Obradovićem","1","",""
"sportklub_4cf0281627","Poter: Fantastičan početak, ali možemo mnogo bolje","0","",""
"sportklub_633f56a316","Partizan Skupštinu kluba zatvorio za javnost","0","",""
"sportklub_bc40e91398","(FOTO) Ovako izgleda kostur najvećeg Mundijala ikada","0","",""
"sportklub_55e6b1a58a","FIFA optužena za tajnu preprodaju ulaznica za Mundijal","0","",""
"sportklub_1ff6886853","Karolina vratila brejk, krećemo od nule","0","",""
"sportklub_87a8462104","Pričaće se o ovoj izjavi: Ovakav meč mora da sudi muškarac","1","",""
"sportklub_fc35e234cd","Jedva dočekao: Ataman ga prozvao i otpustio, sada se svima smeje","1","",""
"sportklub_b05f094d4e","Fenomenalni Mičel doneo Klivlendu pobedu i izjednačenje","0","",""
"sportklub_7e5cbdddb0","Moguć haos u Seriji A: Pet timova sa 71 bodom, Juventus „visi“","1","",""
"sportklub_c39fdaf92d","Petković: Serena se nije vratila da bi igrala samo dubl","0","",""
"sportklub_e56d5c13ec","Dva finala za Srbiju posle kvalifikacija u Montemoru","0","",""
"sportklub_669d28795f","Điro: Gani 10. etapa, Vingegor se opasno primakao roze majici","0","",""
"sportklub_0628408150","Adžić ide na pozajmicu: Sasuolo najbliži crnogorskom biseru…","1","",""
"sportklub_788433aae5","(VIDEO) „Sabotaža“ na proslavi Bajernove titule: „Ku*kini sinovi“","1","",""
"sportklub_d32946e953","Nemci izbegli još teži poraz: Aston Vila osvojila Ligu Evrope!","0","",""
"sportklub_245fc6524e","Zvezda hoće izraelsku zvezdu! Krilo je i ima sjajnu sezonu","1","",""
"sportklub_1ad9312723","Razilaze se Van Persi i Fejenord","0","",""
"sportklub_4b2fa69d16","Šansi je bilo, svežine je nedostajalo: Hamad bez četvrtfinala","0","",""
"sportklub_e8fd4d13ba","Srbija dobila selektora ženske vaterpolo reprezentacije","0","",""
"sportklub_858865ee4a","Moglo je i bolje: Minimalna pobeda Srbije protiv Mađarske","1","",""
"sportklub_11685f7849","Iz TSC-a poručuju: Ne kalkulišemo, želimo pobedu","0","",""
"sportklub_b67f3b2cc5","Crvena zvezda pred gašenjem!","1","",""
"sportklub_09e90f70f8","Bivši plejmejker Zvezde na ceni, stiže u Galatasaraj","1","",""
"sportklub_b7aaa35f99","Joveljićeva majstorija za drugu pobedu Kanzasa","0","",""
"sportklub_e3d3a90c81","(VIDEO) Ozmo iz Pariza: Ko je devojka koju sad zna ceo svet","1","",""
"sportklub_24a63eb1f8","Dubai je baš ambiciozan: Sledeća želja – Jabusele","0","",""
"sportklub_fc224cd597","(VIDEO) Heket glavom udario rivala, Srbima preti eliminacija!","0","",""
"sportklub_30835d1f74","Prvo veliko iskušenje Veljka Paunovića","1","",""
"sportklub_0f9f656c21","Kazna na RG 55.000 zbog: „Ovo mora da sudi muškarac, a ne žena“","0","",""
"sportklub_abc03e94e9","Potvrđeno pisanje SK:Mijailović jedini kandidat za predsednika CZ","0","",""
"sportklub_d835ff39b8","(VIDEO) Gabrijel tragičar: Ovaj momenat je odlučio šampiona","0","",""
"sportklub_9c5e2f4796","Vuljagmeni: Vujasinović selektor do 2028, a u klubu do 2031.","0","",""
"sportklub_ac000eee68","Sedi, udobno se smesti… Dobro došao u ekskluzivni klub, Janiče","1","",""
"sportklub_712b9929e9","„Život leti, kapetane“ 33 godine od odlaska košarkaškog Mocarta","1","",""
"sportklub_6b3d16ff91","Italija lako sa Kovačevom Turskom, Grbićeva Poljska se mučila","1","",""
"sportklub_7bed5a99c8","BLOG: Preokret, tri crvena, pa pečat bivšeg igrača Zvezde","1","",""
"sportklub_5105e1f48f","Iliću vrata otvorena: Blagojević otišao u Akron, ugovor do 2030.","0","",""
"sportklub_89571f33fb","Majstorica odlučuje: Serija 20:0, Vembi blistao, MVP nestao!","0","",""
"sportklub_6e62c1b525","Priča Ivana Vukomanovića: Poslednji ples Huga Brosa","0","",""
"sportklub_4c0a2ac70a","Sezona Virtusa za zaborav: Venecija zbacila branioca sa trona","0","",""
"sportklub_ca039674b9","Partizan želi da potroši 1.500.000 evra u Hrvatskoj","1","",""
"sportklub_7e4b9b4286","Federer se vraća na teren posle četiri godine","0","",""
"sportklub_ecc8335ea0","Miško vraća Drezgića u Džordžiju","0","",""
"sportklub_7937f25c86","(VIDEO) Čista petica za kraj: PSV dao 101 gol u sezoni","0","",""
"sportklub_e184d4d5fa","Takov kod Viška: Zlato u poslednjoj sekundi – ništa slađe","0","",""
"sportklub_cd50d6f265","Kapiten Njukasla na novoj misiji: Vukovi ciljaju povratak u PL","0","",""
"sportklub_16becc8c34","„U tenisu mnogi koriste veštačku inteligenciju za analizu rivala“","0","",""
"sportklub_4999460cc5","Šokantna vest iz SAD: Preminuo NBA košarkaš","1","",""
"sportklub_e073590459","Jaja Ture novi trener Slovana iz Bratislave","1","",""
"sportklub_4cc987026d","Manćini se vraća na mesto selektora Italije!","0","",""
"sportklub_9c4d65af04","FSS: Licence dobilo svih 30 klubova Super i Prve lige","0","",""
"sportklub_f335f18115","Posle skoro osam godina: Trofej za Lasla iz kvalifikacija!","0","",""
"sportklub_72ab9c17ef","Pakao Pariza: Koliko je zaista stepeni i šta to znači za Novaka","1","",""
"sportklub_561f781468","Bojan Janić: A svi su očekivali 0-4 posle prve sedmice…","1","",""
"sportklub_10d20d1d2c","„Zvezda i Partizan kao Globtrotersi! Dozlogrdilo i Bogu i narodu“","1","",""
"sportklub_9877f9c574","Slot veruje da će ostati na klupi Liverpula","0","",""
"sportklub_24a4a323a2","Salah udario na Slota: Nema pregovora, samo hevi-metal fudbal!","1","",""
"sportklub_5722fcc3fd","Pešićev Bajern je u finalu","0","",""
"sportklub_72388738bf","Platini presavio tabak: Tužbe protiv Infantina i FIFA","1","",""
"sportklub_335e407962","Čuda se događaju: Dmitrović slavi pobedu, slavi je i Gudelj!","0","",""
"sportklub_a85cec6194","(VIDEO) Kristijan Eriksen ponovo kolabirao, meč prekinut!","0","",""
"sportklub_8098369742","Narandžasta „metla“ za Stefana Lazarevića","0","",""
"sportklub_8caaba73ed","Čudo: „Jednoruki“ Mark Izleteo na startu, pa zgrabio pol-poziciju","0","",""
"sportklub_c766fcb481","Saša Obradović izdvojio jednu stvar koju Zvezda mora da popravi","1","",""
"sportklub_91fad62353","Direktor Olimpijakosa zagrmeo: Sramota! Janakopulos jurio sudije","1","",""
"sportklub_e64c900056","Štrajk napravio pometnju: Makabi igrao četiri na četiri","0","",""
"sportklub_23ccc7ae51","Đoković: Frustriran sam, teško da mogu daleko da doguram u Parizu","1","",""
"sportklub_83b3b085b2","Ove reči su bile ključne: Hrabro! Nemoj kao pi…","1","",""
"sportklub_25280ec8a4","Stojan Vujko podržao košarkaše Zvezde i Željka Drčelića","0","",""
"sportklub_0c775e5391","Četvrti teniser sveta je u ozbiljnom problemu","1","",""
"sportklub_0876d08f66","Ko će biti novi Dark horse? Norveška, domaćini, opet Afrikanci","1","",""
"sportklub_121c692aa2","Čekali ih satima: Navijači dočekali Džeka i drugove u Torontu","0","",""
"sportklub_fea7c01e98","Luka Dončić i Lejkersi žele Vučevića u Los Anđelesu","0","",""
"sportklub_667553a545","Ekspert za suđenje kritikuje izbor sudija za Valensija – PAO","0","",""
"sportklub_b4fb14f34b","Svi će navijati za njih: Velikan na korak od povratka u Primeru","1","",""
"sportklub_6e6123a711","Ista meta, isto odstojanje pred dan odluke u Splitu","1","",""
"sportklub_9837e3e442","Šta Janakopulos nudi Obradoviću","1","",""
"sportklub_57f82cc8b3","Ključ za Mirovu sudbinu 2 videa, tužilac traži 10 godina zatvora","1","",""
"sportklub_de3b4819d2","(VIDEO) Pobeda Real Madrida i koncert zvižduka za Mbapea","0","",""
"sportklub_af4c16c6eb","„Znao sam da ću doći u Zvezdu! Ne sećam se šta mi je Saša rekao“","1","",""
"sportklub_0cc8b69c59","Kostjuk: Rat je sve promenio u mom životu","0","",""
"sportklub_b7c9b21be4","Roni razmatra da u budućnosti napusti snuker i pređe na bilijar","0","",""
"sportklub_07e4ec7540","Tomić posle debakla: Ne mogu da odgovorim da li ostajem na klupi","0","",""
"sportklub_f9782fde43","Slavlje u Kragujevcu i velika zahvalnost navijačima","1","",""
"sportklub_fa89971d5c","Iz drugog pokušaja: Špic CSKA rešava Partizanove muke u napadu","1","",""
"sportklub_ed96ae04c3","Šelton osvojio Štutgart, uzeo titule na sve tri podloge u 2026.","0","",""
"sportklub_661ed56d68","Fala ku**u, Saša","1","",""
"sportklub_b7b1f674d8","Nikola Manojlović za SK: Mi iz Saveta i RSS smo saigrači","0","",""
"sportklub_07772c0de2","Srđa Knežević se ogradio od Apela: Potpišite se, da znamo ko ste","1","",""
"sportklub_4a70ce4025","KLS odgovorio Partizanu: Menjanje igrača i trenera nije isto","0","",""
"sportklub_14c1a35b7d","(VIDEO) Janakopulos žacnuo svoje igrače: Neka im propadne dan","1","",""
"sportklub_826a3c7ee0","Dukiću izmakla medalja na Evropskom prvenstvu u Splitu","0","",""
"sportklub_0c62b24cd3","Alpin se žali na Gaslijevu kaznu, Kadilak ostao bez prvog boda","0","",""
"sportklub_59f56dc825","Pehar podigao i suspendovani Nemanja Radonjić","0","",""
"sportklub_1f24ab9730","Đorđe Petrović ide u Ligu šampiona ako se poklope tri stvari","1","",""
"sportklub_93571dcad2","Istorijski ugovor: Kinezi „kupili“ Stefa Karija","1","",""
"sportklub_9dc06d3462","Visina koša u NBA ligi","0","",""
"sportklub_2d5fccfb82","De Brujne: Bilo bi sjajno ponovo videti Salaha, a i Marmuša","0","",""
"sportklub_9631dc53cb","(VIDEO) Česi prvo izazvali kolaps u Meksiku, pa dobili kupanje","1","",""
"sportklub_dcceb41b11","Viktorija Emboko se znatno pojačala pred Rolan Garos","0","",""
"sportklub_f61e804a7a","Jan Veseli se emotivno oprostio od košarke posle velike konfuzije","1","",""
"sportklub_e88cfefdba","Jakirović: Neverovatan osećaj, idemo na Vembli!","0","",""
"sportklub_7c6cbb36aa","Rekordi se ruše, veterani se druže","1","",""
"sportklub_b2543fe583","Rade piše: Valensijin sistem koji melje milione i trikove","1","",""
"sportklub_f641b7a4a5","Omladinci Zvezde dobili trenera, Milijaša zamenio bivši saigrač","0","",""
"sportklub_c68d50d0ba","I drugi evropski trofej na Ostrvu, Palasu Liga konferencije","0","",""
"sportklub_d14395f91e","„Da igra ne bude ni nalik onoj iz prošle utakmice, možemo bolje“","0","",""
"sportklub_f617a01702","Miško brani Čimu: Odgovor bivšem igraču „bez ozbiljnije obaveze“","0","",""
"sportklub_2af512fcbc","Pele dobio monumentalni spomenik u Gvadalahari pred SP 2026","0","",""
"sportklub_72f6fad2e1","(FOTO) Evo koliko novca Rolan Garos uzme samo od „šopa“","0","",""
"sportklub_ec2fde1569","Baskonija ponovo bolja od Reala, četvrti put u sezoni!","0","",""
"sportklub_c4c3303c3e","Dubai, kriza i ambicije: Barsa daje 300.000 evra za trenera?","0","",""
"sportklub_a5d8b53621","Dečić prelomio: Ivan Brnović je šef stručnog štaba","0","",""
"sportklub_37454255fb","Medvedev se žalio sudiji zbog pomoći masera Sineru","0","",""
"sportklub_9d933f155f","Grbić uz Đorđevića","0","",""
"sportklub_974ec67357","Stanković nije posetio Kragujevac da podrži vaterpoliste, ali…","1","",""
"sportklub_62916a876e","Nepravda? Osvojiš Ligu šampiona, pa ekspresno dobiješ otkaz","1","",""
"sportklub_626a93e13b","„Nomen est omen“: Sada i Aluminij ima Luku Modrića","0","",""
"sportklub_77cbd51155","Nisu znali gde dolaze: Stigli u kamp na SP, do njih leglo zmija!","1","",""
"sportklub_dee068d52b","Budite kao Kosta","1","",""
"sportklub_64d8fb6c34","Musa predvodi Zmajeve protiv Srbije","0","",""
"sportklub_7107a8f281","Sjajni golovi Venecuele i Turske, lepo društvo u Klivlendu","1","",""
"sportklub_3325c3c559","Natho o Izraelu i Palestini: Želim mir, da svi ratovi prestanu","0","",""
"sportklub_08d51510b8","Novi mandat: Terzić ostao predsednik SD Crvena zvezda","0","",""
"sportklub_aa389e5fdb","Zverev se poigrao sa Mahačem","0","",""
"sportklub_4ba1a06e73","Crvena zvezda, Ibon Navaro i klauzula – šta se sve dešava","1","",""
"sportklub_c554997568","Anastasija: Bila sam nezrela i nervozna, a sada…","1","",""
"sportklub_e217c7b789","Kostjuk: Da je bilo 100m bliže, ne bih imala majku i sestru","1","",""
"sportklub_6ba5c8be3a","Odakle sad ovo? Adam Silver insistira na NBA Evropi","0","",""
"sportklub_0e6a53dedc","Teriju se ne sviđaju Tuhelove odluke: Njih 11 ne mogu da igraju","1","",""
"sportklub_a78a1e074d","Lukić u Radničkom, Mišović blizu NBG, Zvezda na prekretnici","0","",""
"sportklub_00480632c1","Može li Kejn skinuti 56 godina staro mundijalsko prokletstvo?","1","",""
"sportklub_8ce5068ec1","Juniori Zvezde na završnom turniru Evrolige: Bez pritiska","0","",""
"sportklub_c7843bb019","Šengun predvodi Turke, Flin umesto Larkina na „poziciji stranca“","0","",""
"sportklub_c79b15b5c6","NBA uskoro okreće novi list: Tenkovanje više neće imati smisla","0","",""
"sportklub_f6fb6fa0c4","(VIDEO) Navijači Arsenala dali podršku Evertonu protiv Totenhema","0","",""
"sportklub_8823e4d407","FIA priznala grešku: Gasli vraćen na podijum u Monaku","0","",""
"sportklub_892a14731a","Jebrgual Melese, vicešampionka u Čikagu, umrla na treningu","0","",""
"sportklub_2d967ba10e","Kako je Apel za spas Partizana stao na Mijatovićevu stranu?","1","",""
"sportklub_b34f5293d8","Naomi Osaka eliminisala Ivu Jović posle tri sata","0","",""
"sportklub_9001346407","Zvezda prodala štopera u Portugal","0","",""
"sportklub_ec91b51eaa","Kako dočekuje Meksiko, kako SAD: Nekome muzika, nekome poniženje","1","",""
"sportklub_b46b573efe","Suvlasnik Vest Hema optužen za seksualno iskorišćavanje","0","",""
"sportklub_41b6634ace","Baraću malo sjajni Flin, Alimpijeviću triler i prednost u seriji","0","",""
"sportklub_cdaf55b694","Vejn Runi o meču između Kanade i Bosne i Hercegovine","0","",""
"sportklub_7e90352ee0","Simultanka Džanana Muse: Dubai nerešiva enigma za Budućnost","0","",""
"sportklub_eabf2a662d","Kotorani arhivirali nokaut, izabrali šefa stručnog štaba","0","",""
"sportklub_cdf97746c2","(VIDEO) Specijalci sprečili tuču navijača Cibone i Zadra","0","",""
"sportklub_9ea53140f1","Novi musketar: Biser od 17 godina i francuski san","1","",""
"sportklub_e9e736eecc","Opstanak na vidiku: Nikola Štulić – čuvar nade Lećea","0","",""
"sportklub_028a7f584a","Barsa se ne šali: Ponuda od devet cifara za Alvaresa","0","",""
"sportklub_31505e6cbb","Zbog „špijunaže“: Midlzbro traži da Sautempton bude izbačen","0","",""
"sportklub_37196ea7ce","Budućnost ne želi da putuje u Dubai!","0","",""
"sportklub_a8050ee5ad","Solbaken objavio spisak, Norvežani su baš jaki!","0","",""
"sportklub_d808c7b4d9","Roma i Malen – ljubav se nastavlja","0","",""
"sportklub_68af196e42","(VIDEO) Kesa, stegao se… Poštujte karijeru Saše Zvereva!","0","",""
"sportklub_8e4f65f199","Italijan je finalista Rolan Garosa!","0","",""
"sportklub_c34ae0b69b","Crna Gora izgleda odlično pred start Lige nacija!","0","",""
"sportklub_04ccaa1ce5","Iraola potpisao za Liverpul i poručio: „Ja sam jedan od vas!“","0","",""
"sportklub_a8b1258080","Sterling uhapšen pod sumnjom da je vozio drogiran","0","",""
"sportklub_44a9415e90","Dve pobede u danu: Radukanu dobila Ivu, sa Donom za titulu","0","",""
"sportklub_c600fae8a7","Bubliku sudar visokih momaka","0","",""
"sportklub_4022e82e5f","Gvardiola: Niti jedno pivo! Slavićemo kad se završi sezona","0","",""
"sportklub_e2384ea669","Još 3 greške VAR sudija: Everton oštećen protiv Sitija","0","",""
"sportklub_d5c6231890","Gonsales klasa za sebe, Vijeti sa 16. mesta do podijuma!","0","",""
"sportklub_8fd89b006d","Englezi tvrde: Pep Gvardiola u nedelju odlazi iz Sitija!","0","",""
"sportklub_1dbfc045dc","Hrvatska u šoku: „Kraljica diska“ propušta celu 2026. godinu!","0","",""
"sportklub_7436dbd3b5","I Džerami i Kinez i treći pik – Sve to za Janisa","0","",""
"sportklub_5d2ffa2f6e","Sveci uložili žalbu: Najveća kazna u istoriji engleskog fudbala","1","",""
"sportklub_289a46d374","Vest Hem ispao, gol Palinje za opstanak, Gvardioline suze","0","",""
"sportklub_bd4ea923c2","Rusi pišu: Blagojević napušta Partizan?","0","",""
"sportklub_2aaa20f2e8","Trofeji, pa remont: Junak finala među otpisanima","1","",""
"sportklub_6f7f5c95d8","Pljušte otkazi u OKS, na crnoj listi „sportisti – blokaderi“","1","",""
"sportklub_49d4697174","Armoni Bruks: Olimpija gradi ozbiljan tim, nisam doneo odluku","0","",""
"sportklub_cab04b8792","Forest odbio ponudu Sitija, čeka da Andersonu skoči cena posle SP","0","",""
"sportklub_58d05b918d","Burg neće u Evroligu, Francuzi odlučili da ostanu u Evrokupu","0","",""
"sportklub_c8f4ae5c23","Ovako se voli svoja zemlja: Ponosni Škoti probili zvučni zid","1","",""
"sportklub_bc8eb4f7e4","Kasno podizanje zastavice je prošlost, nova tehnologija na SP","0","",""
"sportklub_7a02ed94e6","Otkrivena suma: Abu Fani će imati jaku platu u Zvezdi","0","",""
"sportklub_2138c2c0c2","Sramota: Ataman uvredio svog igrača – „Sa njim smo igrali 4 na 5“","0","",""
"sportklub_2a0632b4ca","(VIDEO) Skariolo kao Toni Montana: „F**k you with this!“","1","",""
"sportklub_a77bb7c13d","Medalje i iskustvo: Pličavice 25. maja zablistale na Malti","0","",""
"sportklub_6b7e5c7003","FSS zatvorio stadion u Kragujevcu","0","",""
"sportklub_aa34509efd","Novi Beograd mora da pobedi Barselonetu","0","",""
"sportklub_74132f7c98","Veliki Edin Džeko: Dirljivo „Pismo deci Bosne i Hercegovine“","0","",""
"sportklub_ec51b72cb2","Rodik: Đoković će biti bolji na Vimbldonu","0","",""
