"id","naslov","labela","podtip","napomena"
"sportklub_f53c9457e1","Biće pakao u 38. kolu LaLige: I dalje pola lige brine za opstanak","0","",""
"sportklub_c5a9e85c43","Popović: Nije važno koliko godina imate, već da li ste spremni","0","",""
"sportklub_1431452cc4","Gudurićev Armani blizu polufinala, Breša izjednačila","0","",""
"sportklub_7b1e563a49","Kerik ostaje na Old Trafordu, Junajted spremio novi ugovor","0","",""
"sportklub_eecb5eb11a","Nula Sent Etjena i Nice, odluka pred praznim tribinama u revanšu","0","",""
"sportklub_a4a9cf3993","Real ovog leta obara Nejmarov rekord: Želi zvezdu od 225 miliona","0","",""
"sportklub_2cacd6ec52","(VIDEO) Šta se ovo desilo?! Nasr imao titulu u rukama, a onda…","1","",""
"sportklub_dabd437414","Predsednik Fenerbahčea osuđen na zatvorsku kaznu","0","",""
"sportklub_a2e3a8fef7","Endo: Želimo da ispišemo novu istoriju japanskog fudbala","0","",""
"sportklub_51c8689259","Stojkanović izabrala za odlučujuće mečeve kvalifikacija","0","",""
"sportklub_a58d42f0f7","Skandalozno: Kristina Rakočević više neće nastupati za Crnu Goru!","0","",""
"sportklub_deace379dc","Siner izabrao pripremni turnir za Vimbldon – u Đokovićevom stilu","1","",""
"sportklub_b1da0829b4","Veliki šok za Virtus u plej-ofu Palakanestra","1","",""
"sportklub_b7d91086ab","Zvezda pojačana ide u Niš po poslednji trofej u sezoni","0","",""
"sportklub_5fbcdb3b12","Snimatelj iznervirao Đokovića: Molim te, bliže mi se unesi u lice","1","",""
"sportklub_60c0b34489","(VIDEO) Raselu „bezobrazan“ duel protiv Antonelija u sprintu","0","",""
"sportklub_44b85d94c9","SKener Vojvodine: Rosićeve parade bez nagrade","1","",""
"sportklub_491775ba4f","Sportisti besni na Koventri koja „ne veruje u plaćanje sportista“","1","",""
"sportklub_204edc31d9","„Đoković je 2011. pobedio mnogo bolje igrače nego Siner sada“","1","",""
"sportklub_4302c0e75e","Vašington: Ostajem li u Partizanu? Ne!","0","",""
"sportklub_66953407c9","Iz Italije: Teodosićev saigrač blizu Zvezde","1","",""
"sportklub_38d9f48954","Ludilo poslednjeg kola na Pirinejima: Pola lige se bori za nešto","1","",""
"sportklub_68695b6cc9","Penjaroja: Nedopustivo za finale, meč traje 40, a ne 32 minuta!","0","",""
"sportklub_d3aad4f8db","Obradović: Kodi ne trenira, nadam se da će se bar neko oporaviti","0","",""
"sportklub_5495c179ee","Điro: Narvaes osvojio i osmu etapu, Vingegor smanjuje razliku","0","",""
"sportklub_8f1703a704","Mark Markes u „klubu 100“, trku obeležio veliki incident","0","",""
"sportklub_8326cbc7cf","Selektor Srbije za titulu u Turskoj","0","",""
"sportklub_b91f51e0cd","Mane predvodi Senegal na Mundijalu","0","",""
"sportklub_cd2807b9e8","Zvezda ispustila +21 u Ljubljani, igraće se majstorica","0","",""
"sportklub_e6c46b438f","Siner je preživeo! Ali još nije dobio Medvedeva","0","",""
"sportklub_85765a7c9b","Vučić: Kad zamolim Novaka, on obezbedi taj reket sa zadovoljstvom","0","",""
"sportklub_7df8095f0a","Posle Kigena, još jedna legenda Liverpula objavila da ima rak","1","",""
"sportklub_4600f9c46a","Dve karte za Nikse ili poveća kuća u Oklahimi – cena je ista","1","",""
"sportklub_7467adbd43","(VIDEO) Koko Gof se „kaznila“ – reketom u glavu","0","",""
"sportklub_b10e364e45","Većina „promašila“ brzi krug, vodeći u Moto3 startuje 15!","0","",""
"sportklub_cdfb08c5de","Prva liga Srbije: Sve rešeno, Furtula izbacio Tekstilac","0","",""
"sportklub_ddf8a50d43","Iran premestio bazu iz SAD u Meksiko zbog bezbednosnih razloga","0","",""
"sportklub_eb5dbb378f","Semenjo predvodi Ganu, otpala druga velika zvezda","0","",""
"sportklub_08aeb4a20f","Kako dodati Sport klub među omiljene izvore na Guglu","0","",""
"sportklub_90061cce24","(VIDEO) Pogledajte sve golove 38. kola Premijer lige","0","",""
"sportklub_8853c7e7e2","Đokić: Uvek sam želeo Zvezdu i Partizan od starta u KLS","0","",""
"sportklub_0b41c22660","Ružno: Navijači vređali kapitena, Zvezdinog „pika“","1","",""
"sportklub_b5e31fc088","Šampion Crne Gore radi punom parom, ostaje i Butsijel…","1","",""
"sportklub_7f7fbb7695","Reprezentativci Engleske opljačkani u SAD","0","",""
"sportklub_c45e36752b","Žemberi o TSC-u posle Orbana: Biće nam kritična Akademija","1","",""
"sportklub_4c8f689730","Tanjga se izvinio Iliću: Shvatio sam da je sudio korektno…","1","",""
"sportklub_1cfd697940","Valensija posle drame srušila Huventud","0","",""
"sportklub_a63d3734ca","Mesi sa 25.000.000 dolara ubedljivo najplaćeniji igrač MLS","0","",""
"sportklub_fc03bfb599","Juniorska šampionka RG iz Rusije. Đoković je moj idol","0","",""
"sportklub_ab13c9b66b","Javor imenovao naslednika Radovana Ćurčića, vratio se i Lišanin","0","",""
"sportklub_86576a2621","Direktor Evrolige: Zvezda i Partizan postaće franšize","0","",""
"sportklub_6e6e1decf8","„Nažalost, Duško Ivanović mi je bio trener…“","1","",""
"sportklub_f734c645bc","Neverovatni Janik Siner dosegao Novaka – „zlatni masters“","0","",""
"sportklub_88aef3e3aa","Vlade posvetio trofej Duletu: Imao je ogroman uticaj na mene…","1","",""
"sportklub_cfaaa0dca3","Šta će tačno odlučiti polufinala Fajnal-fora Evrolige?","1","",""
"sportklub_2be245bfdf","Darderi u fubalskom dimu slomio Hodara za najveće polufinale","0","",""
"sportklub_91f7343f1c","Derbi Lige nacija: Brazil prekinuo rekordni niz Italije!","0","",""
"sportklub_484e259c34","(VIDEO) Ludo slavlje Dejana Stankovića sa Delijama","0","",""
"sportklub_a42565d66b","Penjaroja: Moraćemo da kontrolišemo emocije i da igramo zajedno","1","",""
"sportklub_42b8ebe3c8","Đere odmoran ide u finale! Lajović ispustio derbi sa Kecmanovićem","0","",""
"sportklub_6ed3e7db5c","PAO i epizoda nismo isti: Nećemo ići u drugu ligu","1","",""
"sportklub_960722511e","Terzić posle „duple krune“: Sledeći cilj – međunarodna scena!","0","",""
"sportklub_40b2d9a5c1","Laslo Đere upisao ATP pobedu posle 11 meseci","0","",""
"sportklub_4e5adef034","Nejmar propušta prijateljsku utakmicu protiv Egipta","0","",""
"sportklub_c4973633fb","(VIDEO) Ovo je faul zbog kog se zapalila Atina u sredu","1","",""
"sportklub_7cc0a53116","Legendarni Sale Đorđević ima novi posao!","1","",""
"sportklub_f40a420716","Zvezda „gubi“ Šortsa, navodno je izabrao novi klub!","1","",""
"sportklub_4f91f67846","Centar se vratio u Monako posle samo dva meseca od odlaska","1","",""
"sportklub_518593d6e3","Đoković više nije rekorder, Siner ruši sve granice","1","",""
"sportklub_c8f8bda325","Stanković o Zvezdanu Terziću: Institucija, mnogo pametan i mudar","0","",""
"sportklub_3181737e28","Alkaras: Ne slažem se sa Đokovićem, nisam ničija kopija","0","",""
"sportklub_6e849b5546","Musa i Avramović srušili Partizan, Dubai na pobedu od titule","0","",""
"sportklub_9943ff8ee8","Bez hokejaša Rusije na Svetskom prvenstvu 2027.","0","",""
"sportklub_73b621a1c0","„Zvezdina čuvena magija sa sudijama, to je sramota za fudbal“","1","",""
"sportklub_44d8be6c1f","DR Kongo ne može u SAD zbog ebole? „Nećemo to na našoj granici“","1","",""
"sportklub_6e71ca66ab","Pale se crvene lampice u Argentini: Mesi izašao zbog povrede?","0","",""
"sportklub_b38d822bfd","Izner: Novak iz 2011. bi pobedio Janika iz 2026.","0","",""
"sportklub_acabb5b2d6","„Zeleni karton za planetu? Pre je to veliki srednji prst“","1","",""
"sportklub_38af9c9cd1","(VIDEO) Subotica na nogama: Ovako se dočekuju šampioni","1","",""
"sportklub_6c775a90f0","Otkup Erakovića: Milioni, a tu su i procenti Zenitu","1","",""
"sportklub_367346c53a","Aleksandar Ilić nije uspeo, Stošić jeste: Sjajan FNC 31 u Areni","0","",""
"sportklub_5a94d62bd5","VIDEO: Najbrži dopingovani sprinter sveta ni blizu Useina Bolta","0","",""
"sportklub_26d58ef2be","Zvezda zainteresovana za učesnika Mundijala","1","",""
"sportklub_10ef1bd983","Kraj: TSC ispao u Prvu ligu!","0","",""
"sportklub_7b3c1e8851","I Liverpul je bio spreman: Ovo je novi menadžer „redsa“?","1","",""
"sportklub_4fd2c5ee89","PAO je slao klipove Evroligi, a odgovor…","1","",""
"sportklub_c97dd0c3b2","Serena se vraća, a Koko i Mboko su oduševljene","1","",""
"sportklub_97ac8b5388","Španci tvrde: Najbolji strelac u istoriji EL stiže u Barsu","1","",""
"sportklub_8c88745dfa","Stigla podrška sa stare adrese: Zvezda je uz Čovića!","1","",""
"sportklub_f2d1b58148","Srbin ponovo u finalu Lige šampiona","1","",""
"sportklub_9971c88c79","Paun menja plan: Srbija u novom sastavu put Lisabona i Meksika","0","",""
"sportklub_48d21ee562","Anastasija Cvetković u četvrtfinalu Rolan Garosa","0","",""
"sportklub_f6a070b468","Novi blokbaster u LA: Remsi Geretu priključuju legendu?","1","",""
"sportklub_31d3495465","Angelina preskočila 194 cm, pa se povukla sa takmičenja","0","",""
"sportklub_b43dae72a8","Škotska bez standardnog golmana, na SP ide i 43-godišnjak","1","",""
"sportklub_c903ca1a22","Montreal razbio odmornu Karolinu na startu polufinala NHL lige","0","",""
"sportklub_faa5b4f9c7","Ni Zvezda, ni… Loša vest za Partizan u finišu sezone!","1","",""
"sportklub_ad3e5bc7d9","Basara novi gensek, odlaze direktori","1","",""
"sportklub_66f0a94b37","Terzić: Kao da smo im bili sparing partner na treningu","1","",""
"sportklub_16782fa7ba","Preminuo mladi trener Efesa posle 30 dana borbe","1","",""
"sportklub_3bc9ec858a","Iznenađenje: Konačan spisak Francuza za SP bez zvezde Reala","1","",""
"sportklub_9cfe5762a3","Markez: Nisam potpuno zadovoljan, problem – prednji pneumatik","0","",""
"sportklub_6b969b5787","Srbin među najvrednijima na svetu, a nema ga u reprezentaciji","1","",""
"sportklub_898ea5e441","Fonseka se ne šali: Pao i Kasper Rud","1","",""
"sportklub_4be004a1ff","Beceki za SK: Pozitivan dan, uvek može brže","1","",""
"sportklub_c66dabe862","Skariolo: Olimpijakos je najbolji među najboljima","0","",""
"sportklub_c2243f4252","Mekinro o Novaku, Fonseki i Sereni: Ako Novak osvoji 25…","1","",""
"sportklub_97adc05991","(VIDEO) Emotivno u studiju SK o velikom Marku Podraščaninu","1","",""
"sportklub_40ee786bec","Fis: Volim što Ivanišević uvek kaže ono što misli","1","",""
"sportklub_5b591a8f90","(VIDEO) Senzacija u UFC: Gejdži unakazio Topuriju u Beloj kući","0","",""
"sportklub_6afa06cafe","Ko bi nam fudbal „dao“ besplatno ako ne Florentino Perez","1","",""
"sportklub_a2a1bd9ebf","(VIDEO) Hrvati propuštali šanse, Belgija slavila na Rujevici","0","",""
"sportklub_f5c2801e02","Junak dana: Selekcija Australije","1","",""
"sportklub_78738dd80b","Mačak, Mundijal, prognoza, premijer… Da li imamo novog Pola","1","",""
"sportklub_b4bda5e760","Jovana Nogić ponovo dvocifrena, Nikolina Milić ipak slavila","0","",""
"sportklub_74bdfb556c","„Nečuveno je da igrač Real Madrida nema mesto u Engleskoj“","0","",""
"sportklub_f8433789f9","Ataman svestan situacije: Ako mi Janakopulos više ne veruje…","1","",""
"sportklub_f26504c637","Pogodio 3 puta: Nemački ekonomista ‘zna’ ko će biti šampion sveta","1","",""
"sportklub_6f9de5e3b4","Rud: Svi znamo da je bez Novaka i Janika RG otvoren za sve","0","",""
"sportklub_77a4c51875","Posle 49 godina: Zvezda oborila rekord Hajduka","1","",""
"sportklub_3c977f81a1","(VIDEO) Pogledajte sve golove 34. kola Bundeslige","0","",""
"sportklub_133906fc3b","Pele i Tijeri Anri dobili svoje ulice u Njujorku","0","",""
"sportklub_a8ce514b57","Četvorica sjajnih igrača pod velikim znakom pitanja za Vimbldon","1","",""
"sportklub_20a04e135c","Nisu baš „Sveci“: Istraga odlaže finale plej-ofa za Premijer ligu","1","",""
"sportklub_d2840c0b0b","Trener Dubaija o tome šta je ključno u duelu sa Partizanom","1","",""
"sportklub_402066d351","Evans slavio u Japanu i povećao vođstvo u prvenstvu","0","",""
"sportklub_78c5c31ae5","Džekova poruka navijačima: Vi uz nas, mi za Bosnu i Hercegovinu","0","",""
"sportklub_65e7a2754d","Odličan start za Krunić i Danilinu","1","",""
"sportklub_253c3c1343","Maraton obeležio 9. dan: Viteških pet i po sati – Arnaldi je zid","1","",""
"sportklub_320a083237","(VIDEO) Obezbeđenje definitivno nije bilo spremno na ovo","1","",""
"sportklub_e60a033a9b","Zvezda ostaje bez napadača, odlazi za 4.300.000 evra","1","",""
"sportklub_ca507d9b45","(VIDEO) Vijeti: Kad je tu Vale, posebna motivacija","1","",""
"sportklub_1434359184","Debi, gol, titula, sve sa 16 godina: Maks Dauman ušao u istoriju","0","",""
"sportklub_4bfe53e555","(VIDEO) Island na svojoj koži osetio novo striktno pravilo FIFA","1","",""
"sportklub_564e02b017","Perez vraća Modrića i Krosa u Real Madrid","0","",""
"sportklub_07d50cfc05","Blagojević zagonetno o sledećoj sezoni: Mnogo je nedoumica…","1","",""
"sportklub_f0fc30a65c","Milvud u nadoknadi doneo Srbiji pobedu u kvalifikacijama za EP","0","",""
"sportklub_46be2c6349","Barać stao na korak od preokreta, Alimpijević izborio majstoricu","0","",""
"sportklub_c0f7a0e49e","Sunovrat bivšeg UFC šampiona! Tri poraza za godinu dana","1","",""
"sportklub_07d459d80c","Konor Mekgregor se vraća!","0","",""
"sportklub_d4f4b50760","Večeras na Mundijalu: Veče pored Edina Džeka i alarm za Amere","1","",""
"sportklub_220977fd95","NBA ponovo u Evropi, San Antonio i Nju Orleans igraju u dva grada","0","",""
"sportklub_efeafa4e4c","Ostaje! Šarl Lekler potpisao novi ugovor sa Ferarijem","0","",""
"sportklub_d1dace12c5","Zvanično je: Navaro novi trener Zvezde!","0","",""
"sportklub_f89ccd2a8b","Ribakina krenula ka broju 1","1","",""
"sportklub_21c9316bf3","Preminuo čuveni vozač Kajl Buš (41)","0","",""
"sportklub_9da75da66e","Fener konačno pao: Larkin i Lojd postigli više od polovine poena","0","",""
"sportklub_cc181fd5ae","Selektor Popović produžio ugovor sa Australijom","0","",""
"sportklub_eb70880c0a","Ovo je spisak delegata koji će odrediti Partizanov dalji put","0","",""
"sportklub_10f8d3ed2a","Haos pred finale: Tuča Delija i policije u Loznici","0","",""
"sportklub_d82ff444d6","Srbija ili Grčka? Stojaković: Uskoro se sastajem sa oba tima","0","",""
"sportklub_c78afb0c45","Aleksej Nedeljković je biser, ali Zvezdini klinci su eliminisani","0","",""
"sportklub_e32726d067","Maverik Vinjales se vraća u Barseloni","0","",""
"sportklub_0d31f2d729","Nove dobre vesti za Alimpijevića i reprezentaciju Srbije","1","",""
"sportklub_d620f7b288","Prekršajni postupak protiv članova UO Košarkaškog saveza Srbije","0","",""
"sportklub_37774cffa1","Reko slavio u Zagrebu, šampion Evrope lako sa Hanoverom","0","",""
"sportklub_044e9da37c","Pad Đokovića na 8. mesto","0","",""
"sportklub_c62740c9f5","Hamilton obećao Antoneliju: Juriću te do kraja sezone","0","",""
"sportklub_55a561102c","Alimpijević: Nikola Jokić će igrati za Srbiju ovog leta","0","",""
"sportklub_84afbaa644","Koboli kao Andrejeva: Čestitam sebi na uspehu","0","",""
"sportklub_c239abb345","Njujork u strahu od haosa: Meč Francuza i NBA finale isti dan?","0","",""
"sportklub_cab022d03e","Drčelić: Trening centar KK Crvena zvezda zvaće se po Cveletu","0","",""
"sportklub_554841886d","Dimitrov otpustio Nalbandijana i vratio Delgada","0","",""
"sportklub_6a2ffe9bcf","Mijatović savetuje Florentina: Treba da prodamo jednog od njih…","1","",""
"sportklub_4e00f4bced","Paunović u Pančevu na oproštaju od superligaške sezone","0","",""
"sportklub_f93028223f","Rolan Garos: Fonseka preti Đokoviću","1","",""
"sportklub_d3bd281836","Pobeda Vingegora u 9. etapi, Eulalio i dalje lider na Điru","0","",""
"sportklub_adaaf8405d","„NBA Evropa kreće u oktobru 2027, saopštili smo uslov Evroligi“","1","",""
"sportklub_3382e034a9","Šampion Evrope i sveta se vraća u Evroligu","1","",""
"sportklub_d20a2e0667","Pobednici/gubitnici sezone: PSŽ na samom vrhu, Čelsi dotakao dno","1","",""
"sportklub_f76cb97ebe","FMP se plasirao u finale KLS i zbacio Partizan sa trona","0","",""
"sportklub_876182c833","Novine u hrvatskoj ligi: Za forsiranje mladih igrača milion evra","1","",""
"sportklub_586bdfb6e5","Motori upaljeni: Crnogorske „ajkule“ oštre zube za Sidnej","1","",""
"sportklub_b7cee5fb2a","Svi za Niš – besplatno! „Ovo nije meč koji se gleda od kuće“","1","",""
"sportklub_8fe995b8b2","„U Zvezdi mi rekli da nisam talentovan, pa sam otišao u Partizan“","1","",""
"sportklub_08ce030035","Malo je 48 reprezentacija, FIFA planira novo proširenje na SP","1","",""
"sportklub_9fd352b33a","Panatinaikos: Barcokas vređao tim menadžera… Dosta je bilo!","1","",""
"sportklub_c3c81141d8","Martinez u finalu branio sa slomljenim prstom","0","",""
"sportklub_d393430931","Lučić u sporednoj ulozi, Pešićev Bajern na korak od finala","0","",""
"sportklub_c64111f3ce","Evroliga uzvraća udarac NBA: 52 kluba pozvana da učestvuju!","0","",""
"sportklub_529f4eae5f","Asvel za rekordan iznos dovodi Silvena Fransiska","1","",""
"sportklub_738d8e5ad3","Jakovljević i Smailagić za sada izbegli nokaut…","1","",""
"sportklub_969527ca42","Diogo Žota na spisku Portugala: Dirljiv gest selektora Martineza","0","",""
"sportklub_8b21559e8b","Šek spremio giljotinu za Vembija: Išao bih po njegovu glavu…","1","",""
"sportklub_332cf792d8","Partizan na krilima pobede protiv Zvezde cilja brejk u Dubaiju","0","",""
"sportklub_74dd0b616b","Ružan razlog zbog kojeg je Saša Obradović ostao bez Evrolige","1","",""
"sportklub_7ab04c0696","Put Zvezde do Lige šampiona: Ovo su svi mogući rivali","0","",""
"sportklub_f786f9fbad","VIDEO: Stravičan sudar Akoste i Markesa, čekamo vesti o Aleksu","0","",""
"sportklub_1adab12558","Hvalinska: Samo se molim da Đoković nastavi da igra, da ga gledam","0","",""
"sportklub_1746bc1b09","Stanković: Rodigrao u špicu? Kao Žoze sa Samuelom protiv Sijene","0","",""
"sportklub_8119eefa6c","Srbija maksimalna protiv Tajlanda, sjajan start u Nanđingu","0","",""
"sportklub_9a13469d48","Italijani našli kompromis, derbi Rima ipak u nedelju u podne","0","",""
"sportklub_3885993668","Ko je Toni Popović, Hrvat iz Sidneja koji je razbio Tursku?","1","",""
"sportklub_30fe51f8ed","(VIDEO) Nan vs Džons, ko je prvi počeo? Pojavio se novi snimak","1","",""
"sportklub_8fd8ea6746","Zvezda čeka ponuđača: Neko je zainteresovan za Babiku","1","",""
"sportklub_8a105f5f62","Glasajte i vi za najboljeg menadžera i igrača Premijer lige","0","",""
"sportklub_02c541f9e6","(VIDEO) Šturm predstavio pojačanje iz Javora vredno 2,2 miliona €","1","",""
"sportklub_4ed2f11914","Rade piše: Otišao Saša – pojeo vuk magarca","1","",""
"sportklub_804e500b42","Suze i očaj: Povredio se pred debi za BIH, možda propusti SP?!","1","",""
"sportklub_d4bb6eb963","Sent Etjen u plej-ofu za Ligu 1, Sošo se vratio u Ligu 2","0","",""
"sportklub_ffbb675726","Gomez o neizvesnoj budućnosti u Liverpulu: Sve je moguće","1","",""
"sportklub_df4b913ae4","Navijač utrčao na teren zbog Vembanjame, dobio doživotnu zabranu","0","",""
"sportklub_29164c6dca","Valgrenu 17. etapa na Điru, Vingegor odbrojava dane do pobede","0","",""
"sportklub_39ef413061","Barsa „razbila“ Tenerife na početku polufinalne serije","0","",""
"sportklub_52eb356a6f","Bomba iz Italije: Diđa napušta Rosija i odlazi u KTM","1","",""
"sportklub_6e2e9f1c41","Voziće se još u Las Vegasu, bar do 2037.","0","",""
"sportklub_d4995828ff","Budućnost promovisala šefa stručnog štaba!","0","",""
"sportklub_d831babeeb","Mihajlo Andrić potpisao novi ugovor sa Breoganom","0","",""
"sportklub_c70c6c95fc","Oglasio se i RSS povodom prekida u Novom Sadu","1","",""
"sportklub_04f873327a","„Kalates odigrao poslednji meč u Partizanu“","1","",""
"sportklub_4b9e4accd0","(VIDEO) O navijačima Škote priča ceo svet…","1","",""
"sportklub_034767cd37","Srbija u drugom šeširu pred žreb za Svetsko prvenstvo","0","",""
"sportklub_f78afe77bd","Zbog maltretiranja sudije: Nanova devojka kažnjena godinu dana!","0","",""
"sportklub_10fd79e17e","Reko potopio Olimpijakos, cilja 12. titulu prvaka Evrope!","0","",""
"sportklub_ee89bfda37","Šteta: Jojo morala bolje, Finiks poleteo i vratio se u pepeo","0","",""
"sportklub_b1342ae885","„Cadena SER“: Ovo su igrači Reala na koje Murinjo ne računa!","0","",""
"sportklub_6b1fd3b8cf","Vojvodina pravi silan tim: Stiže i Zukić!","1","",""
"sportklub_b6ebe779d9","Marko Nikolić vodi u AEK još dva Srbina","1","",""
"sportklub_4633169e1d","Kadeti će u četvrtak dobiti rivale za Svetsko prvenstvo","0","",""
"sportklub_015303bcea","Trinkijeri počeo od pleja: Stiže prvo pojačanje za PAOK","0","",""
"sportklub_6cb4cf5095","„Bol je jedino što osećam u ovom trenutku“","1","",""
"sportklub_4c2b569ff5","Nije kao Pavlović, Pavić izabrao Hrvatsku pre Nemačke","0","",""
"sportklub_371ebe7b20","(VIDEO) „Došao sam na F4 po trofej, MVP kao jagoda na torti!","1","",""
"sportklub_172d3fe7fc","Navijači Arsenala slave titulu, Pevci strepe za opstanak","0","",""
"sportklub_5a2d7f3a77","Janakopulos prihvata sve Željkove uslove, baš sve!","1","",""
"sportklub_3e43d95ed5","Partizan tražio da u Nišu promeni stranca","0","",""
"sportklub_08b2b059a3","Blenđini: Srbija je igrala bolje i zaslužila je pobedu","1","",""
"sportklub_1f6bb373a3","Minimalac Škotske sa Haitijem, prva pobeda na SP od 1990. godine","0","",""
"sportklub_10b0d29480","Saša Ilić obavio prozivku, crno-beli u Beogradu do 27. juna","0","",""
"sportklub_11b21da08a","(VIDEO) Navijači Arsenala u epizodi „Ko se poslednji smeje…“","1","",""
"sportklub_34e28a21cb","(VIDEO) Tuča i dva crvena kartona na prijateljskom meču!","1","",""
"sportklub_ca81e476cd","Istorija se ponovila: Barseloneta šampion Evrope!","0","",""
"sportklub_9c7cb8d9ac","(VIDEO) Kakve scene: Ejup na stadionu Fenera izborio opstanak!","0","",""
"sportklub_464d488796","Karolina na korak od Stenli kupa, Uragani nadigrali Vegas","0","",""
"sportklub_9b0466843e","Kasiljas: Ništa lično, ali ne želim Murinja u Realu","1","",""
"sportklub_e41f4c1838","Perfektan dan za ljubitelje odbojke u Crnoj Gori","1","",""
"sportklub_50b361c1de","(VIDEO) Biti ili ne biti: TSC igra za opstanak u Superligi","0","",""
"sportklub_753b7853e9","Slavko Perović na odlasku iz Radničkog 1923: Tužan sam i ponosan","0","",""
"sportklub_d6b74c6dd8","Legendarna srpska odbojkašica okončala karijeru","1","",""
"sportklub_5f5cc9f086","Micić čovek odluke, Madar MVP: Brejk Hapoela u Jerusalimu","0","",""
"sportklub_9d5fc61e17","Nik i Džoi Bosa zajedno u SF? Trenutno više razmišlja o golfu","1","",""
"sportklub_4cb219ed30","Arteta: Zamislite da smo uspeli… Ništa ne može da ublaži bol","0","",""
"sportklub_f8cec1aba5","Perez ne miruje, sada o Alonsu, Mbapeu, Vinisijusu i Murinju","1","",""
"sportklub_8dd1af89d0","Kejn optimističan: Imam velike šanse da osvojim Zlatnu loptu i SP","0","",""
"sportklub_7dd62d37bb","Al-Kelaifi: Hvala Bogu da smo mi verovali","0","",""
"sportklub_cc70520244","Magija bivšeg igrača Zvezde za preokret Koreje protiv Češke","1","",""
"sportklub_f3dbda7321","Sautempton ostao bez plasmana u Premijer ligu zbog špijunaže","0","",""
"sportklub_558b311b3c","Bastajić stigao u Suboticu","0","",""
"sportklub_291d3d551a","Od kritika do ovacija: Mesi je razmazio navijače Majamija","0","",""
"sportklub_08c9cd910d","Predsednik istočnog regiona KSS: Išao bih i u zatvor zbog Čovića!","1","",""
"sportklub_18ad18b2db","Rade piše: Ko je blefirao da ima karte za F4 – Valesija ili PAO?","1","",""
"sportklub_07ff993f6b","Nekad bio promašaj Partizana, sada ima važnu funkciju u Bulsima","1","",""
"sportklub_bccaa938ca","Sve je bilo jasno i pre finala: Već je poznat NBA šampion!","1","",""
"sportklub_704bbe0f18","Pariska bajka: Od „ne živi mi se“ do polufinala Rolan Garosa","1","",""
"sportklub_b7b44562ba","Da li je ovo klub za njega? Dortmund želi Vasilija Kostova","0","",""
"sportklub_bd6cc79e2c","Betiol pobedio na „svom“ terenu","0","",""
"sportklub_4f02e7d685","Gordon potpisao, pa progovorio španski","0","",""
"sportklub_39603ab99d","Tijafo izdržao, prošao Feliks ali i 104. na svetu","0","",""
"sportklub_25f913a878","Partizan potvrdio: Saša Ilić se vratio","0","",""
"sportklub_5baebd27c0","Sada je zvanično – Serena Vilijams se vraća na teren!","0","",""
"sportklub_2a5f3659bf","Ataman: Ako nam dozvole da igramo po pravilima, bićemo šampioni","0","",""
"sportklub_5adaa99638","Depor se vratio: Plavo-bele košulje ponovo će marširati Primerom!","0","",""
"sportklub_6a815d5220","Katastrofa: Avdić teško povredio koleno","0","",""
"sportklub_66dca9f735","Partizan hoće u Ligu šampiona, ali se u EHF plaše…","1","",""
"sportklub_77d1357feb","Rastužio celu Francusku: Ivaniševićev učenik propušta Rolan Garos","1","",""
"sportklub_c744f2e77b","Luna krenula stopama Ane i Jelene","1","",""
"sportklub_98a9c448b5","Junajted pokušava da spusti cenu i dovede fudbalera Atalante","1","",""
"sportklub_dbceb3e090","„Među najcenjenijima, miljenik navijača“: Sani ostaje u Breoganu","0","",""
"sportklub_2156d0869b","Prvi potpis Crvene zvezde","1","",""
"sportklub_0d364c065a","Šou nije izostao: Povratnik Kirjos stao na pragu nove pobede","0","",""
"sportklub_869021d2f7","Golac za SK: Svi oni se rugaju Partizanu","1","",""
"sportklub_f30856308b","Seniori u subotu putuju u Brazil","0","",""
"sportklub_3e268e4d71","Crvena zvezda posle 16 godina vratila legendarnog kapitena","1","",""
"sportklub_fabc8e4406","Prvi stranac na klupi odbojkaša Crvene zvezde","0","",""
"sportklub_1af8310854","(VIDEO) Novaka ne volim, previše je pobeđivao","1","",""
"sportklub_2cd1b5e588","Dogovorio transfer na Old Traford, pa priključen Brazilu za SP!","1","",""
"sportklub_8b8bbf20c0","SGA: Ovako i u trećoj; Vembanjama: Pogađa je ono što inače pogađa","0","",""
"sportklub_2aabda1215","Malerozni Lesor: Dva puta izgubio posle istorijskog preokreta!","0","",""
