"id","naslov","labela","podtip","napomena"
"sportklub_a9edf1beed","Stiže teška artiljerija! Ozvaničena još dva meča za UFC Beograd","1","",""
"sportklub_ccb9cfe150","Nemanja Nedović oslobođen kazne","0","",""
"sportklub_3de27ddfbc","Senzacija: Katar šokirao Švajcarsku u nadoknadi!","1","",""
"sportklub_2d49b47d88","Uoči SP ponovo isplivao snimak na kojem se Infantino obrukao","1","",""
"sportklub_9ed44e8bde","Crvena zvezda definitivno bez licence, TSC i Spartak u Evropi","0","",""
"sportklub_fa9b9a2344","Čeng oduševljen mladićima: Neko da izazove Alkaraza i Sinera","1","",""
"sportklub_65b4a07da3","Veseli rešio da se oprosti u stilu, odveo Barsu do 2:0!","0","",""
"sportklub_0c507410d3","Jovetić, Savić i Krstović preskaču Bugare i Slovake","0","",""
"sportklub_807af929f1","Genijalni umovi: Golman sa Harvarda, napadač govori 9 jezika…","1","",""
"sportklub_3db26ed7a2","(VIDEO) Laki luzer Dona Vekić osvojila titulu posle tri godine","0","",""
"sportklub_24daa122a7","Tojota posle četiri godine pokorila 24 časa Le Mana","0","",""
"sportklub_a687cf7fa0","„Šta god da se desi“ sa Duejnom Vašingtonom i Partizanom…","1","",""
"sportklub_683dc6ef2a","Fonseka: Đokovića sam previše poštovao, sa Rudom je bilo lakše","0","",""
"sportklub_99bb4d1925","Marija pomera granice, leti ka Los Anđelesu","1","",""
"sportklub_4bcbe401d2","Ko posle Mesine? Ideja je da dođe poznati Turčin…","1","",""
"sportklub_14876c82b8","Kutlaj o Hejz-Dejvisu: Ljudi da nauče da ćute i osete sramotu","1","",""
"sportklub_2afef1595a","Košarka u Italiji u znaku želje Partizana: MVP Kupa, MVP lige","0","",""
"sportklub_99048e1d1f","Novo pojačanje za Partizan: Stigao div iz Sarajeva","1","",""
"sportklub_a2ca838429","Fonseka zaustavljen: Spektakularni Čeh ide u polufinale!","1","",""
"sportklub_e913af8fb3","Napoli od 0:2 do 2:2, ali Bolonja servirala šok u 90+1","0","",""
"sportklub_49269d40db","„Sudije su grešile! FMP se oslanja na Srbe, a pogledajte Spartak“","1","",""
"sportklub_5a123c04bf","(VIDEO) AEK u slavljeničkoj atmosferi remizirao sa Olimpijakosom","0","",""
"sportklub_4ba4dada04","Nema Evrope? Enca Fernandeza više ne interesuje Čelsi","1","",""
"sportklub_f5cc4301cb","Nan dobio ponudu koja se ne odbija: 10.000.000 za pet godina!","0","",""
"sportklub_55b69ee29c","Ništa, ništa… pa eksplozija! Derbi dana nadmašio očekivanja","1","",""
"sportklub_441a89b133","Đokovićeve reči u Nadalovom muzeju","0","",""
"sportklub_e7a13d820e","Dva produžetka, devet golova i Golden najtsi vode 2:1","0","",""
"sportklub_8a5763a544","Čak i Siner mora da predahne – Kejhil otkrio kada","1","",""
"sportklub_bf609b4f85","Zoran Terzić odredio 16 reprezentativki za Kinu i Filipine","0","",""
"sportklub_3058b10701","Ajkula sjajno pliva u Balatonu: Odličan krug Akoste","0","",""
"sportklub_c3ba0307cd","Čudesna Hvalinska u ekstazi: Nekada sam luda, unutra je oluja!","1","",""
"sportklub_ecb8c66da3","Partizan uzvratio (jedan) udarac, šampion će juriti majstoricu","0","",""
"sportklub_2e67c80df4","Gladović: Ništa nije gotovo!","1","",""
"sportklub_1ca65752bb","Hofenhajm doveo jednog od najboljih igrača Cvajte","0","",""
"sportklub_1148c5c0bc","Misija ispunjena: Robert Levandovski definitivno ide iz Barselone","0","",""
"sportklub_8131626351","Marota u epizodi „neće on niđe“: Bastoni ostaje u Interu","0","",""
"sportklub_b26a44546d","Hrvati kažnjeni zbog spornih zastava i vređanja sudija","0","",""
"sportklub_0208ef45c7","Madriđani sa Emirejtsom do 2031. za 500 miliona evra","0","",""
"sportklub_93b5a77be6","Vingegor čuva prednost, Manije došao do treće etapne pobede","0","",""
"sportklub_00ce989258","Drama u Istanbulu: Doužer promašio pobedu, Fener ima 2:0","0","",""
"sportklub_517cf4727d","Svitolina je kraljica trećih setova, kraj za Švjontek u Rimu","0","",""
"sportklub_eb281a170a","Đoković pao na ATP listi, sad je baš važan žreb za Vimbldon","0","",""
"sportklub_a35adb7df4","Duel pod maskama: Spens na Modrića 17. juna u Dalasu","0","",""
"sportklub_782faae235","SK analiza: Svi detalji finansijskih obaveza KK Crvena zvezda","0","",""
"sportklub_869ff105f6","Nikolić na rastanku: Nisam imao dobar odnos sa upravom","0","",""
"sportklub_2a04c4686d","Iran će moći da doputuje u SAD dan pre odigravanja utakmice","0","",""
"sportklub_21d1acc123","Penjaroja: Dobar recept na putu ka majstorici!","0","",""
"sportklub_09c4dbca3a","Teniseri planiraju protest na Rolan Garosu zbog nagradnog fonda","0","",""
"sportklub_40b23755b8","Dominacija Kilesa i jeziv udes za kraj trke u Mađarskoj","0","",""
"sportklub_ac75a09714","SK: Zvezda i Teo – kontakt ostvaren, ali…","1","",""
"sportklub_6b68939aaa","Komemoracija Vladimiru Cvetkoviću: On je oblikovao vreme","0","",""
"sportklub_fa3dc6ccda","Sale Đorđević se vraća na mesto najvećih uspeha!","1","",""
"sportklub_a07c31c0cd","Očekivano: Nju Orleans na premijeri NFL u Parizu","0","",""
"sportklub_bc7ffb4aaf","Ljulj: Sezona za zaborav, izvinite, Madridisti!","0","",""
"sportklub_05d2c874c5","Obradović je bivši, šta sve Tomić donosi Zvezdi","0","",""
"sportklub_66ba8224f7","Tragičar Larkin promašio pobedu, Fener prvi finalista","0","",""
"sportklub_ee757d6456","Injigo Peres novi komandant „Žute podmornice“","0","",""
"sportklub_6004c4507a","Amerikanci kažu: Prognani sudija imao veze sa teroristima","1","",""
"sportklub_b546c450b1","Rašović pred Novi Beograd: Korak po korak do trona","0","",""
"sportklub_6a3d22854c","Rusi veruju Srbinu: Tomović ostaje u Lokomotivi","0","",""
"sportklub_5fc6843254","„Dubai dobio prvu rundu, za titulu su potrebne tri pobede“","0","",""
"sportklub_d3325d29e4","Rusi moraju do petka da reše situaciju sa Blagojevićem","1","",""
"sportklub_0e596ca00d","Šampion je spreman, a spreman je i Mesi","1","",""
"sportklub_407605163e","Navijačice Meksika su se već proslavile (VIDEO)","1","",""
"sportklub_995e0e3070","Rapsodija Alimpijevićevog Bešiktaša, i Barać blizu polufinala","0","",""
"sportklub_1817e3a1e4","Srbija razbila Australiju, pa Austriju za četvrtfinale SP","0","",""
"sportklub_36324e19f2","Novi šok za Vlahovićev i Kostićev Juve; Spaleti: Mrtvi smo!","1","",""
"sportklub_22a3a3499d","Šta nas čeka na Mundijalu: Vinisijusov zakon, VAR se više pita","1","",""
"sportklub_6044b6631b","Rolan Garos, 2. dan: Hamad saznao rivala, dva heroja se oprostila","1","",""
"sportklub_6419af2533","Željko sve dalje od PAO, Ataman uprkos neuspehu ostaje?","1","",""
"sportklub_8a18a5d74c","Danas: Dejan Stanković podržao selektora i vaterpoliste Srbije","0","",""
"sportklub_fa6f80c343","Ako Markes ne bude spreman za Muđelo – zna se zamena","1","",""
"sportklub_7b06b921c0","Piši propalo! Partizan ponovo ostao bez napadača","1","",""
"sportklub_2fd6dc74f0","„Željko Obradović prvi kandidat za klupu Panatinaikosa“","0","",""
"sportklub_46898f9d8f","Rojević i Đukić vode Ohrid ka istorijskom evropskom trofeju!","0","",""
"sportklub_a314939606","Peter Prevc u Beogradu: SP na Planici šansa za ceo region","1","",""
"sportklub_b5530f93d3","Srpski fudbaler na meti Fiorentine","1","",""
"sportklub_2448955ebf","(VIDEO) „Slavićemo do Beograda, volimo vas sve! Živela Srbija!“","1","",""
"sportklub_bbd38feebe","Kolumbija i Ekvador u dobrom raspoloženju idu na SP","1","",""
"sportklub_ac7c5d1fd5","Evo kada srpski igrači počinju takmičenje na Rolan Garosu","0","",""
"sportklub_f5a20a57bc","Derbi izostao! Italijan predao polufinale, publici povraćaj novca","0","",""
"sportklub_457551d52a","Uplakani sin i roštilj: Kako je Arteta saznao da je šampion","1","",""
"sportklub_77272401be","Kod Riversa nije bilo discipline, a prednjačio je Janis","1","",""
"sportklub_69288184de","Kreće osma Liga nacija za dame, treba li Srbiji F8 u Makau?","1","",""
"sportklub_7d43a219ca","Malo igrača ima i NBA i titulu Evrolige: Kuzmić u krem društvu","0","",""
"sportklub_4c95f0ce0e","Turci dolaze po Marka Nikolića","0","",""
"sportklub_effb88691e","Saznajemo: Lalatović odlazi iz Novog Pazara","0","",""
"sportklub_bdd7684edb","Saigrač želi da Vlahović ostane, a on bi da ide iz Juventusa","1","",""
"sportklub_0e0bdf2c6e","Kvalifikacije za EURO 2028: Sve jednostavnije nego za Mundijal","1","",""
"sportklub_4c82a93355","Gudelj pristaje na sve samo da ostane u Sevilji","1","",""
"sportklub_da85846187","Blagojević pred odlaskom, Partizan traži novog trenera","0","",""
"sportklub_74aeacaf52","Darko Stošić o sledećem rivalu: Mirko „Cro Cop“? Stvarno, ne…","1","",""
"sportklub_74b9e906d9","Barsa slavila, Lamin otišao najdalje: Otrovna strela ka Madridu","1","",""
"sportklub_eedef029bb","Umalo tuča između tenisera u susretu kvalifikacija Rolan Garosa","1","",""
"sportklub_c523f9acfe","Trener Mege koja nema poraz: Treba imati karakter za to","0","",""
"sportklub_b90303a5ba","„Znate na koju odluku mislim, mogao je i da ga povredi“","1","",""
"sportklub_b243db52f4","Hezonja: Nije čudno igrati bez centra; Kampaco: Hrabro i pametno","1","",""
"sportklub_b12d5c751d","Slovenija ispustila Slovačku, ali opstanak je na vidiku","1","",""
"sportklub_7a1cb95641","Novi Beograd ima recept: Stop za Nikolu Jakšića i Prlainovića","1","",""
"sportklub_3d9680e881","Momak koji je srušio rekord iz 1930.","1","",""
"sportklub_cbaab24da0","Vrlo loš početak Evropljana, pet mečeva i samo jedna pobeda","1","",""
"sportklub_fab192d658","„Žan“ ili „Đan“ – Montero za SK otkrio kako mu se izgovara ime","1","",""
"sportklub_c05d8d0a74","Nekada sjajni bek, sada čudo od trenera – pred vratima Bajera","1","",""
"sportklub_ba313749b2","Janiću mediteranska, Mitroviću juniorska selekcija Srbije","0","",""
"sportklub_d041a9f8f5","Zvezdaši na Mundijalu: Sedmorica igraju, otpali Bukari, Kraso…","0","",""
"sportklub_688844b552","Real se pojačao na „kriznoj“ poziciji pred početak plej-ofa","1","",""
"sportklub_d4dd9556b7","Od „mentalno slomljene“ do top 50 – povratak hrvatske nade","1","",""
"sportklub_43791d9e24","Zverev: Sada znam kako da rešavam neke situacije","1","",""
"sportklub_6222d8506f","Kostjuk posvetila press ratu Ukrajine i Rusije: Kako može Darija?","1","",""
"sportklub_0e63308489","Matićev trener ostaje u Seriji A: Groso na klupi Fiorentine","0","",""
"sportklub_f4d5b4a996","OFK Beogradu 2.000.000 evra od Crvene zvezde","0","",""
"sportklub_9dc30c9d00","Zvezda pustila u prodaju sezonske ulaznice, ovo su cene","0","",""
"sportklub_9304f14886","HNK Šibenik i zvanično ugašen, novi klub kreće od najnižeg ranga","0","",""
"sportklub_148dcc3024","Evo zašto Dejan Stanković ne vodi Zvezdu u Surdulici","0","",""
"sportklub_4b203ef60d","Norveška u SAD donela 300 kg ribe, 116 kg sira, 6000 pomorandži","0","",""
"sportklub_15bd0c548b","Hejs-Dejvis poručio navijačima PAO: Niste Dejv Šapel","0","",""
"sportklub_b22a0ebcbe","Sudija imao diplomatski pasoš, vizu… ICE ga vratio kući","1","",""
"sportklub_eba964e810","„Zvezda voli saopštenja“ – Mitrović: Ne zanimaju me ove gluposti","1","",""
"sportklub_de271383a3","Tradicija: Šej častio za MVP priznanje paprenim časovnicima","1","",""
"sportklub_d4e701ca0c","ABA liga ne dozvoljava Dubaiju da igra kod kuće!","0","",""
"sportklub_424a7a8e09","Ekskluzivno: Slavoljub Muslin kod Gojka i Viška (petak, 21)","0","",""
"sportklub_de6d455526","(VIDEO) Šveđani u 90+5 ispustili pobedu nad Grcima","0","",""
"sportklub_9ed74c4239","Karolina za prvo finale posle 20 godina! Uragan „oduvao“ Montreal","0","",""
"sportklub_14272cd8be","Tiknizjan emotivan: Hvala Bogu, porodici i Vojvodini!","1","",""
"sportklub_5f1a5e81cd","Jedan igrač Partizana se oporavio, jedan i dalje van stroja","1","",""
"sportklub_51a06b8da8","Pogodite koji klub će imati najviše igrača na SP","1","",""
"sportklub_2bdd422c64","Habi osvojio bronzu na kadetskom šampionatu Evrope","0","",""
"sportklub_a69fda26cf","Baskonija slavi Luvavu-Kabaroa, Lazarevićev Bilbao srušio Real","0","",""
"sportklub_1036c579c2","DP u biciklizmu „zatvara“ saobraćaj na potezu Gajdobra-Čelarevo","1","",""
"sportklub_b05b7e0fb8","Neverovatna pobeda Strazbura, Pariz pao u finišu","0","",""
"sportklub_dae9db0172","Srbija oslabljena u Meksiku: Otpali Živković i Milošević","0","",""
"sportklub_7a188fa528","Kongo ne može da igra u Španiji, gradonačelnik otkazao meč","0","",""
"sportklub_4220cfa5ac","Murinjo obavestio upravu: Tri zvezde moraju da traže novi klub","1","",""
"sportklub_02250e193d","Novakove reči rasplakale Vavrinku: Veliki šampion rekao „zbogom“","1","",""
"sportklub_816669f3a6","Svideo mu se trenerski posao: Endi Mari ima novog učenika!","1","",""
"sportklub_b1d75ea22d","Duplantis tri puta rušio na 6,32, sjajni Slovenac Čeh","0","",""
"sportklub_d3e904689d","Tinejdžerka-„veteranka“ ili igračica koja nije imala za hotel?","1","",""
"sportklub_69037b30dc","Ajuk izvređao poslodavce: Male s..onje, besni što su ispali glupi","1","",""
"sportklub_479c2ead26","Lazović zbunjen: Kome država pomaže, Mijatoviću ili Partizanu?","1","",""
"sportklub_701c48d178","Balerini izbegao haos i osvojio Napulj","0","",""
"sportklub_35aca5bfcb","Vrelina finala: Moćna Zvezda, željna Voša i ratovi van terena","1","",""
"sportklub_4c5ebef208","(VIDEO) Marjanović se zaleteo na navijače, jedva ga zaustavili","1","",""
"sportklub_879f822cb0","Čelsi predstavio novog trenera: Ovo su prve reči Ćabija Alonsa","0","",""
"sportklub_9a4f8fc4be","Olise, Olise, pa još jednom Olise! Francuska je spremna za SP!","1","",""
"sportklub_2d3910ccb7","Veliki uspeh: Andrea Berišaj osvojila bronzu u Minhenu","0","",""
"sportklub_0692711910","Hrabra Crna Gora poražena od Danske na startu šampionata Evrope","0","",""
"sportklub_36543e2974","Promena u poslednji čas: FIFA Haitiju zabranila dresove","0","",""
"sportklub_70b035cc7c","Glazner: Neverovatnih 15 minuta na početku drugog poluvremena","0","",""
"sportklub_7005a7d535","„To bi bilo to“ – Sabalenka prekinula novinare","0","",""
"sportklub_b7cf0abfe8","Ludilo u Kordobi: Belgrano u tri minuta srušio River za titulu","0","",""
"sportklub_d4959d2e77","(VIDEO) „Osećali smo se timski baš moćno“","1","",""
"sportklub_31c9a716dd","Siti osvojio i drugi Kup, magija Semenja za trofej","0","",""
"sportklub_84921bf854","Luis Dias predvodi Kolumbiju, Džejms Rodriges na trećem Mundijalu","0","",""
"sportklub_58df24001c","Kaningemu rekord rimskog mitinga, Lajls najbrži na stotki","0","",""
"sportklub_2aa0c6bac7","SK u Atini: Savršeno mesto za beg od gužve","1","",""
"sportklub_1453a940d1","Evo do kada Vojvodina čeka Dejana Zukića","0","",""
"sportklub_ab47310c05","Atalanta „prošetala“ novi grb u Firenci","0","",""
"sportklub_9de38b1dd7","Noris se vratio na stazu i dan završio tik ispred Rasela","0","",""
"sportklub_b85d79eba6","RG kvalifikacije: Izgubile i Lola i Teodora","0","",""
"sportklub_4f869687a5","(VIDEO) Rus doneo pobedu Rumunima","0","",""
"sportklub_d868540da3","Paskval plaća da dođe na Jadran! Čeka ga najveći ugovor ikada","1","",""
"sportklub_cc973a9183","Milosavljev i Marsenić nisu uspeli, Barsa na evropskom tronu!","0","",""
"sportklub_4ce1698e39","Čudesan preokret Niksa: Od -22 u finišu do pobede u produžetku!","0","",""
"sportklub_097ef783a2","Podijum tri sata posle trke: Mir kažnjen, Banjaja treći!","1","",""
"sportklub_8bcaf079f6","Zvezda u problemu: Transfer Ovusua pred propadanjem","1","",""
"sportklub_a70871d281","Prvi potez Partizana po završetku sezone","1","",""
"sportklub_c1d79573eb","Asvel pravi francuski „drim tim“ za narednu sezonu?","1","",""
"sportklub_83bead82e2","„Nema filozofiranja i opcija, ciljamo pobedu protiv Dubaija“","0","",""
"sportklub_c21df09b04","Brazil zaustavio pobednički nalet Srbije","0","",""
"sportklub_bbab2c7f87","Ko su najplaćeniji selektori i koliko zarađuju?","1","",""
"sportklub_330f4b77a8","Šampionski: Još jedan odrađen posao Ige Švjontek","0","",""
"sportklub_a56204d57d","Virtus uzvratio udarac, Venecija nije imala šanse","0","",""
"sportklub_acb6d08f1a","Dubl u Berlinu: Moguć duel Krunićeve i Serene","0","",""
"sportklub_9a8ba33d07","Agasi: Ne mogu da shvatim šta se desilo Sineru, nešto tu ne štima","1","",""
"sportklub_5f8fb288f0","Beograd domaćin Kongresa Svetske skijaške federacije","0","",""
"sportklub_719c3663b9","Pao dogovor: Posle drugog mesta, Voša uzima i pojačanje Partizanu","1","",""
"sportklub_7cd1f677b8","Medvedev: Tenis se promenio i to mi ne odgovara","1","",""
"sportklub_01c23f3155","FS Škotske presudio: Nepostojeći penal pogurao Seltik ka tituli","0","",""
"sportklub_bdf4ef4c61","Nikola Vučević na prekretnici – NBA ili Evropa?","0","",""
"sportklub_e475e4ffa3","Partizan u čemernoj atmosferi krenuo ka tituli!","0","",""
"sportklub_802c642d25","Muratoglu navodi najveći Novakov problem ako želi da osvoji RG","1","",""
"sportklub_389ff628f0","Sutjeska ima titulu u rukama, Mornar se nada čudu, ali…","1","",""
"sportklub_12709c24a3","Na sahrani Vladimira Cvetkovića Vučić, Mijatović, Džajić…","1","",""
"sportklub_2c45ec5f48","Orlići golom Tadića slavili u prvoj proveri pred Mundijal","0","",""
"sportklub_250d8f4ff4","Budućnost slavi duplu krunu, nisu tužni studenti, naprotiv…","1","",""
"sportklub_7aeb5530a5","Sabalenka: Sad bih se povukla iz tenisa!","1","",""
"sportklub_0dc0437cd4","Bajernu dupla kruna posle šest godina, surovi Hari Kejn","0","",""
"sportklub_ea6d25fb90","Džoel Bolomboj i Crvena zvezda – kraj puta","1","",""
"sportklub_6d86ee3567","Transfer karijere u 29. godini: Argentinac u Totenhemu","1","",""
"sportklub_4d140ef21e","Porazi odbojkaša i odbojkašica, Ukrajina i Poljska slavili pobede","0","",""
"sportklub_0182c02235","Alimpijevićeva rampa Feneru: Bešiktaš brejkom poveo u finalu","0","",""
"sportklub_741eeac6f4","Gvardiola o odlasku: Imam još godinu ugovora","0","",""
"sportklub_67d7f33ece","Gradonačelnica Toronta optužuje FIFA: Oni samo žele da zarade","0","",""
"sportklub_a1b6c7d023","Zvezdi se povredio još jedan igrač!","1","",""
"sportklub_4582442d71","Švjontek: Da li smo mi robovi!?","1","",""
"sportklub_e641ce667b","Sarajevo bolje od Željezničara na zatvaranju sezone u BIH","0","",""
"sportklub_c8ea6eef6c","Crvena zvezda: Nemamo finansijskih obaveza prema Saši Obradoviću","0","",""
"sportklub_20f267208e","Novak nahvalio rivala: Nikako nisam mogao to da pročitam…","1","",""
"sportklub_21c3f22d5d","(Ne)opravdane kritike na račun RG: Štite Sinera od velike vrućine","1","",""
"sportklub_a84be6537a","Nadalova tajna: Davila me je pljuvačka i morao sam kod psihijatra","0","",""
"sportklub_94439a111f","Murinjo odobrio: Denzel Damfris je novi igrač Reala","0","",""
"sportklub_bfeda594e4","Mekinro: Koboliju 30 odsto, suluda konferencija za medije","0","",""
"sportklub_d31a7ef8f3","Kecmanović: Novak mi je poslao poruku…","1","",""
"sportklub_c1e5da1cf4","Spektakl uoči Mundijala: Norvežani i Marokanci remizirali","0","",""
"sportklub_61dfe8c019","(VIDEO) Majstore, kapa dole! Kakva dijagonala za finale Kupa!","1","",""
"sportklub_1e6f56ac12","Uhapšen Džoš Džejkobs","0","",""
"sportklub_869d335816","Da li je danas na RG stvarno biti ili ne biti Aleksandra Zvereva","1","",""
"sportklub_733cd11d38","Feđa Dudić se vraća u Kragujevac, biće trener i direktor!","0","",""
"sportklub_cab1a4660b","Natho: Teške godine, vratiće se Partizan!","1","",""
"sportklub_cbb2d5a481","Selektor Parker: Nisu svi hteli na SP, igrati svakog leta – teško","1","",""
"sportklub_57db18ac27","(VIDEO) Kraj bajke duge 29 godina: Volfsburg ispao iz Bundeslige!","0","",""
"sportklub_810ca6c55f","Matijas Lesor „precrtao“ bivšeg saigrača","1","",""
"sportklub_0f7bfc173b","Može li Budućnost da spasi ludu sezonu?","1","",""
"sportklub_ffd3666d10","Paunović pozvao još jednog debitanta","1","",""
"sportklub_6ef1cf0b1c","(VIDEO) Nikad teže: Ajaks uhvatio poslednji voz za Evropu","0","",""
"sportklub_f27150db0e","UFC Beograd – nastupa Albanac kojem su oduzeli zastavu","0","",""
"sportklub_b34ebfdfc3","Restart Budućnosti: Mujović odbio Careviće, stiže Radulović…","0","",""
"sportklub_71755f798c","Anđela brojala do osam za slavlje Vašingtona","0","",""
"sportklub_e84a0d7872","Real traži od UEFA da izbaci Barsu i oduzme joj 23 trofeja?!","0","",""
"sportklub_7b73610158","Vasić pred drugi okršaj sa Radničkim: Jedan trijumf menja sve","1","",""
"sportklub_6b3061a0f8","Terzić nije nezadovoljan: Hrabri smo, a kad dođu Tijana i Maja…","1","",""
"sportklub_6bee7f5adf","Pojačanje za komšije: Centar Bostona igra za Bosnu protiv Srbije","1","",""
"sportklub_bd7c5bbeb3","Očoa uz rame Mesiju i Ronaldu","1","",""
"sportklub_d421c0d9a4","Hit Evrobasketa: Hteli ga Partizan i Zvezda, on bira Podgoricu","1","",""
"sportklub_8fd304d7e5","Počele prijave za Beogradski maraton","0","",""
"sportklub_702eb5a0b3","Fonseka: Ni sam nisam verovao u pobedu","0","",""
"sportklub_f2dbc34940","„El Rey de Dubrovnik“: Hezonja je MVP španske lige!","0","",""
"sportklub_46c9712175","Španci zaratili s Ražnatovićem: Oštre reči o srpskom menadžeru","1","",""
"sportklub_25b36e176c","Umro Leivinja, ikona Atletika i brazilski reprezentativac","0","",""
"sportklub_736f2586b3","Vlada Srbije finansira nove terene Zvezde, OFK Beograda, Mačve…","0","",""
"sportklub_5a233fb95e","Četvrta etapa Narvaezu, Čikone novi vodeći","0","",""
"sportklub_7f008d8f7c","Mornar pisao istoriju u finalu Kupa, Barani slave Denkovića","0","",""
"sportklub_81ebe21f14","Potpisano: Balov četiri godine u Zvezdi","0","",""
"sportklub_5100d52b2c","Arijeta do pobede nakon pada i pogrešnog skretanja","0","",""
"sportklub_964782dd00","Ukrajinka preterala pred derbi s Ruskinjom: Gestapo i Aušvic!?","1","",""
"sportklub_8165163e96","Kultni dresovi krojili istoriju Svetskog prvenstva","1","",""
"sportklub_13568b9e24","Nenad Milijaš preuzima TSC","0","",""
"sportklub_5a6237c826","Vojvodina se oglasila o stanju igrača povređenog topovskim udarom","0","",""
"sportklub_b852bcfc55","Pada odluka: Senzacija Valensije ili će se PAO ušunjati na F4","1","",""
"sportklub_aef8e43f27","Prazne tribine na startu Mundijala: FIFA već na udaru kritika","0","",""
"sportklub_c1021ca39d","Bivši igrači Partizana razočarani: Nisu KLS pravila „Sveto pismo“","1","",""
"sportklub_d3e2efc5bb","(VIDEO) Biciklista proklizao sa staze i odleteo u šumu","0","",""
"sportklub_644a71ab65","Skariolo o Hezonji: To je bila moja misija od prvog dana","1","",""
"sportklub_499a845dca","Dubai se ne šali: Budućnost da dođe ili idemo u Lozanu","1","",""
"sportklub_2a2ccb1970","Nolan Smit uhapšen zbog prebrze vožnje","0","",""
"sportklub_3c713fe40c","Zvanično: Liverpul smenio Slota!","0","",""
"sportklub_44cf99b29f","Vermezović za SK: Pomešane ingerencije glavni problem u Partizanu","1","",""
"sportklub_d3b7f806c9","Ros Bron ima novi posao – u Moto GP šampionatu!","0","",""
"sportklub_18829fc2eb","Maša Nikolić blistala na Ritam kupu","0","",""
"sportklub_e1bd39bc00","SP 2026: „Košarkaš“ Vigele najviši fudbaler u istoriji Mundijala","1","",""
"sportklub_7953d686a4","Predsednica Meksika: Iranci da dođu kod nas? Nema problema!","0","",""
"sportklub_0905e9b84a","Čelsi će tužiti Mančester Siti zbog pregovora sa Mareskom","0","",""
"sportklub_5897d7dfaf","Reprezentativac Crne Gore ostaje u Podgorici","1","",""
"sportklub_ed535159a5","„Sumnjam da će Karlos igrati na Vimbldonu, Nole može do titule“","1","",""
"sportklub_abf618dd98","Prvo finale bez večitih: Spartak opet izbacio Zvezdu za istoriju!","0","",""
"sportklub_855971df1b","(VIDEO) Šampionski vatromet Crvene zvezde u sitnim satima","1","",""
"sportklub_c519bd7941","Da može, Đoković bi trenirao kao da ima 29 a ne 39 godina","1","",""
"sportklub_719f7e0cdb","Kako je Dauda završio u Zvezdi? Pretnje, laži i strah za život","1","",""
"sportklub_9ccda24b31","(VIDEO) Martin „pokosio“ petoricu vozača na startu trke","0","",""
"sportklub_66f694f398","Haos u Nantu: Vaha se svađao sa huliganima, plakao u svlačionici","1","",""
"sportklub_be1325d5d9","(VIDEO) Kim Džong Un posetio šampionke, histerija na dočeku","1","",""
"sportklub_670fb17d54","Ugovor je na stolu: Počinje bitka za Luku Jovića","1","",""
"sportklub_31e01edef0","Mogao je Noletu da donese još jedan slem… Sad ide u penziju","1","",""
"sportklub_89f17c4ff5","Nikola Jokić u MVP trci – nije bio ni blizu","1","",""
"sportklub_e0192430ee","Rafa: Rodžer je čista magija, a Novak talenat plus rad","0","",""
"sportklub_2e38080a7d","Čukarički potpisao ugovor sa jednim od najvećih bisera kluba","1","",""
"sportklub_be33643cc6","Dobre vesti za Španiju: Jamal, Vilijams i Munjoz spremni za SP","0","",""
"sportklub_b40a19230e","(VIDEO) Šampion remizirao u Solunu, novi gol Luke Jovića","0","",""
"sportklub_826af300fc","SK saznaje: Selektor Srbije novi trener poljske Resovije","0","",""
"sportklub_a35de021f3","Evroligaš „zagrizao“ za Sterlinga Brauna","1","",""
"sportklub_0819c8799d","Real „udavio“ Valensiju za 22. finale Evrolige","0","",""
"sportklub_7453f3e1f7","Novak: Turnir? Videćemo kakvo će stanje biti u Srbiji, Grčkoj…","1","",""
"sportklub_bd8285dbfb","Maverik Vinjales za SK: Kad su mi izvadili šraf…","1","",""
"sportklub_d1ff90ae56","Lekler: Sramota me je","1","",""
"sportklub_7b44820d7b","(VIDEO) Ataman poludeo zbog Tajrika Džonsa: Došao i udario Nana!","1","",""
"sportklub_8aee5ab22a","Direktor Juvea: S tim zahtevima Vlahović neće ostati u Italiji","1","",""
"sportklub_8921f3c008","Vinisijus ne daje izjave: „Nema veze, platićemo kaznu!“","0","",""
"sportklub_a0ed88b4dd","Alan Prost povređen i opljačkan u porodičnoj kući","0","",""
